id,title,title_en,client,category,category_en,summary,summary_en,tags,results,results_en,content_background,content_bg_en,content_challenges,content_chall_en,content_approach,content_approach_en,content_outcome,content_out_en
sustech,テクノロジースタートアップの包括的成長支援（バリューアップ）,Comprehensive Growth Support (Value-up) for a Technology Startup,Sustech,Incubation / Startup Support,Incubation / Startup Support,シードからシリーズCまでの一貫した資金調達支援に加え、AI開発、大企業アライアンス、RPOによる人材獲得まで、全方位での成長ファストパスを提供。,"In addition to end-to-end fundraising support from Seed to Series C, provided an omnidirectional growth fast-pass encompassing AI development, major corporate alliances, and talent acquisition via RPO.","AI Development, Fundraising, Hands-on Management, RPO","シードからシリーズCまで資金調達成功
AI開発体制の早期確立
飛躍的な事業成長のエコシステム構築","Successful fundraising from Seed to Series C
Early establishment of an AI development framework
Ecosystem construction for exponential business growth",再生可能エネルギー領域においてAI活用を目指す有望なスタートアップであったSustech。しかし、革新的なアイデアを実現するための資金、優秀なAIエンジニアの確保、そしてスケールするための事業基盤が不足していました。,"Sustech was a promising startup aiming to utilize AI in the renewable energy sector. However, they lacked the capital to realize their innovative ideas, the ability to secure highly skilled AI engineers, and the solid business foundation necessary for scaling.",シード期特有の資金繰りの不安定さ、高度なAI開発を担う人材の枯渇、そして大企業とのアライアンス構築という、スタートアップが直面する「死の谷」をいかに越え、爆発的な成長軌道に乗せるかが最大の課題でした。,"The greatest challenge was how to cross the 'Valley of Death' faced by startups—characterized by unstable cash flow during the seed stage, a shortage of talent capable of advanced AI development, and the difficulty of building alliances with major corporations—and place them on an explosive growth trajectory.",Tryfundsは単なるコンサルティングではなく「共同創業者」の立ち位置で参画しました。最初のシードマネー調達から、シリーズA、B、Cに至るまでのリードインベスターを全てTryfundsがネットワーキングし紹介。同時に、経営陣を自社から派遣し、経営の地盤を強固にしました。さらに、不足していたAI開発においてはTryfundsの親密先企業のリソースをフル活用し、RPO（採用代行）を通じて事業拡大に必要な人材をスピーディに供給。大企業とのアライアンス構築も主導しました。,"Tryfunds participated not merely as consultants, but from the standpoint of 'Co-founders.' We exclusively networked and introduced all lead investors from the initial seed money raise up to Series A, B, and C. Simultaneously, we fortified their management foundation by dispatching executives from our own firm. Furthermore, to address the shortage in AI development, we fully utilized the resources of Tryfunds' closely affiliated companies, and rapidly supplied the talent required for business expansion through RPO (Recruitment Process Outsourcing). We also took the lead in building alliances with major corporations.",資金、人材、開発リソース、ネットワークというあらゆるミッシングパーツをTryfundsが補完することで、Sustechは驚異的なスピードでの成長を実現。スタートアップにとっての「成長のファストパス」となるモデルケースを確立し、現在も再生可能エネルギー×AIの領域で業界を牽引しています。,"By complementing all 'missing parts'—capital, talent, development resources, and networks—Tryfunds enabled Sustech to achieve growth at an astonishing speed. establishing a model case that serves as a 'growth fast-pass' for startups, they continue to lead the industry in the renewable energy × AI domain."
general-oyster,EBITDA▲7億円からのV字回復・黒字化リード,Led V-shaped Recovery and Return to Profitability from Negative EBITDA of 700M JPY,ゼネラル・オイスター,Turnaround / Hands-on Management,Turnaround / Hands-on Management,巨額の赤字に苦しむ外食チェーンに対し、CEO・COOを直接派遣。徹底したコストダウンとHR改革により、劇的なV字回復を実現。,Directly dispatched a CEO and COO to a restaurant chain suffering from massive deficits. Realized a dramatic V-shaped recovery through radical cost reduction and HR reform.,"Turnaround, Executive Dispatch, Cost Reduction, HR Reform","EBITDA▲7億円から黒字化達成
CEO/COO派遣による経営改革
安定的な人材供給体制の構築","Achieved profitability from an EBITDA deficit of 700 million yen
Management reform via CEO/COO dispatch
Construction of a stable talent supply system",日本有数の牡蠣チェーンを展開するゼネラル・オイスターは、外部環境の変化や不採算店舗の増加により、EBITDAがマイナス7億円という深刻な経営危機に陥っていました。,"General Oyster, operating one of Japan's leading oyster restaurant chains, had fallen into a severe management crisis with an EBITDA of negative 700 million yen due to changes in the external environment and an increase in unprofitable stores.",単なるアドバイスでは立て直しが不可能なフェーズであり、強力なリーダーシップによる抜本的なコスト構造の改革と、現場を支える人材（HR）の再構築が急務でした。,"They were in a phase where simple advice could not turn things around. It was urgent to implement a fundamental restructuring of the cost structure through strong leadership, and to rebuild the human resources (HR) supporting the frontline.",Tryfundsは事業再生のプロフェッショナルとして、自社からCEOおよびCOOをターゲット企業へ直接送り込みました。現場の最前線に入り込み、不採算部門の整理やサプライチェーンの見直しを含む徹底的なコストダウンを断行。さらに、外食産業の離職率の高さを克服するため、全く新しいHR改革プログラムを導入し、質の高い人材が安定的に供給されるシステムをゼロから設計しました。,"As professionals in corporate turnaround, Tryfunds directly dispatched a CEO and COO from its own firm to the target company. Embedding ourselves in the absolute frontlines, we carried out radical cost reductions, including the liquidation of unprofitable divisions and a thorough review of the supply chain. Furthermore, to overcome the high turnover rate typical of the restaurant industry, we introduced a completely new HR reform program and designed a system from scratch to ensure a stable supply of high-quality talent.",トップダウンとボトムアップの両輪によるハンズオン改革の結果、短期間でEBITDAマイナス7億円から見事な黒字化を達成。息を吹き返した同社は、再び強固な事業基盤をもとに新たな成長戦略を描ける体制へと生まれ変わりました。,"As a result of hands-on reform driven by both top-down and bottom-up approaches, the company achieved an impressive return to profitability from a negative EBITDA of 700 million yen in a short period. Revitalized, the company was reborn with a resilient business foundation capable of envisioning new growth strategies."
warehouse-dx,ベンダーロックインからの脱却と年間数十億円のコスト削減,Breaking Free from Vendor Lock-in and Achieving Billions of Yen in Annual Cost Reductions,大手倉庫会社,Digital Transformation (DX),Digital Transformation (DX),大手IT会社への過度な依存を脱却するため、Tryfunds内製ラボでシステムを開発。ライセンス課金モデルの導入により、圧倒的なコスト削減を実現。,"To break free from excessive reliance on a major IT firm, Tryfunds developed a system within its in-house lab. Achieved overwhelming cost reductions by introducing a license billing model.","DX, Vendor Independence, In-house Lab, Cost Reduction","年間2桁億円規模の大規模コスト削減
ベンダーロックインからの完全脱却
事業連動型ライセンスモデルの構築","Large-scale cost reduction amounting to billions of yen annually
Complete liberation from vendor lock-in
Construction of a business-linked licensing model",全国に巨大な物流網を持つ大手倉庫会社。基幹システムの運用保守を特定の世界的 ITベンダーに完全に握られ、毎年のように突きつけられる値上げ要求に付き合い続けざるを得ない「ベンダーロックイン」状態に陥っていました。,"A major logistics company with a massive nationwide network. They were completely held hostage by a specific global IT vendor for the operation and maintenance of their core systems, trapped in a 'vendor lock-in' state where they had no choice but to comply with price hike demands thrust upon them almost every year.",レガシーシステムのブラックボックス化により、自社での機能追加や改修が不可能。DXを進める上でのランニングコストが経営を圧迫しており、この鎖を断ち切り、自社主導のデジタル化を進める必要がありました。,"Due to the legacy systems becoming a black box, it was impossible to add functions or make modifications in-house. The running costs of advancing DX were pressuring management. It was crucial to break these chains and advance digitalization led by the company itself.",Tryfundsはシステム開発の「下請け」としてではなく、戦略的テクノロジーパートナーとして参画。Tryfundsの内製開発ラボを活用し、既存のレガシー機能を代替する最新鋭のシステムをスクラッチで開発しました。特筆すべきは、開発費用をクライアントに一括請求するのではなく、システムの「利用回数」に応じてチャージする独自のSaaS型ライセンス体制を構築した点です。,"Tryfunds participated not as a 'subcontractor' for system development, but as a strategic technology partner. Utilizing Tryfunds' in-house development lab, we developed a state-of-the-art system from scratch to replace the existing legacy functions. Most notably, rather than billing the client a lump sum for development expenses, we established a proprietary SaaS-type licensing structure that charges based on the system's 'usage frequency'.",クライアントは巨額の初期開発投資を抑えつつ、大手ベンダーからの完全な脱却に成功。システムコストが圧倒的に最適化され、結果として年間で2桁億円を超える大規模なコスト削減を実現しました。物流DXにおける新しいパートナーシップの形を提示しました。,"The client succeeded in completely breaking away from the major vendor while keeping massive initial development investments in check. System costs were overwhelmingly optimized, resulting in large-scale cost reductions exceeding billions of yen per year. We presented a new form of partnership in logistics DX."
ukai-global,「うかい亭」の海外初進出・ベトナム財閥とのJV構築,First Overseas Expansion of 'UKAI-TEI' and JV Formation with a Vietnamese Conglomerate,うかい,Global Expansion,Global Expansion,日本の高級飲食ブランド「うかい亭」の海外展開を、東南アジアの有力財閥とのジョイントベンチャー組成から店舗立ち上げまで支援。,"Supported the overseas expansion of the premium Japanese restaurant brand 'UKAI-TEI,' from structuring a joint venture with a leading Southeast Asian conglomerate to launching the restaurant.","Global Expansion, Cross-border, Joint Venture, F&B","海外一号店の立ち上げ成功
ベトナム有力財閥とのJV組成
グローバルブランド構築への第一歩","Successful launch of the first overseas restaurant
JV formation with a leading Vietnamese conglomerate
The first step towards building a global brand",最高級の鉄板料理で名を馳せる「うかい亭」。国内では確固たる地位を築いていましたが、さらなる成長のためには、富裕層が急増している成長アジア市場への海外初進出が不可欠でした。,"'UKAI-TEI,' renowned for its top-tier Teppanyaki cuisine. Although they had established an unshakable position domestically, their first overseas expansion into the growing Asian market, where the wealthy population is rapidly increasing, was essential for further growth.",言語や文化、商習慣が異なる海外において、ブランドの「おもてなしの心」と品質をいかに維持するか。さらに、現地での最高立地の確保や許認可取得をスムーズに進めるための、強力なローカルパートナーの選定が最大の障壁でした。,"How to maintain the brand's 'spirit of hospitality' and quality overseas, where language, culture, and business practices differ? Furthermore, the greatest barrier was selecting a powerful local partner to smoothly secure the best location locally and obtain permits and licenses.",Tryfundsが持つ「政権中枢から財閥トップへ至るネットワーク」を活用し、ベトナムにおいて圧倒的な影響力と不動産開発力を持つトップ財閥をパートナーとして選定。単なる紹介に留まらず、ジョイントベンチャー（JV）のスキーム構築から資本提携の条件交渉、そして現地での店舗立ち上げのプロジェクトマネジメントまでを一貫して伴走しました。,"Leveraging Tryfunds' network 'from the center of government to the top of conglomerates,' we selected a top conglomerate with overwhelming influence and real estate development power in Vietnam as a partner. Going beyond a mere introduction, we consistently accompanied the client from constructing the Joint Venture (JV) scheme and negotiating the terms of capital alliance to the project management of the local restaurant launch.",ベトナムの首都において最高級の立地を確保し、「うかい亭」初の海外店舗を大成功でオープン。現地の富裕層だけでなく、グローバルエグゼクティブを顧客に取り込み、うかいブランドの国際化に向けた鮮烈な第一歩を踏み出しました。,"Securing a premium location in the capital of Vietnam, the first overseas 'UKAI-TEI' restaurant opened with great success. By capturing not only the local wealthy class but also global executives as customers, they took a striking first step towards the internationalization of the UKAI brand."
phil-company,空中店舗事業の加速と強力なプロジェクトマネジメント支援,Acceleration of Aerial Store Business and Strong Project Management Support,フィル・カンパニー,Business Acceleration,Business Acceleration,駐車場の上空未利用スペースを活用する独自の「空中店舗」事業に対し、プロジェクトリーダーを直接派遣し、アライアンスを拡大。,"Directly dispatched project leaders to expand alliances for their unique 'Aerial Store' business, utilizing the unused space above parking lots.","Business Acceleration, Executive Dispatch, Alliance, Real Estate Tech","経営者・マネジメント層の派遣
有力プロジェクトパートナーとの提携
空中店舗開発のスピード倍増","Dispatch of executives and management layer
Partnerships with leading project partners
Doubled the speed of aerial store development",都心部の駐車場上部（空中）という未利用空間に目をつけ、独自の立体店舗を企画・開発するフィル・カンパニー。斬新なビジネスモデルが評価され、急速な拡大期を迎えていました。,"Focusing on the unused space above parking lots (aerial space) in urban areas, Phil Company plans and develops unique multi-level commercial units. Their innovative business model was highly evaluated, and they were entering a phase of rapid expansion.",案件数の激増に対し、地主との交渉、設計・建築フェーズ、テナント誘致の全てを高いレベルで統括できるプロジェクトマネジメント層が圧倒的に不足。成長のボトルネックになっていました。,"Against the explosive increase in projects, there was an overwhelming shortage of project managers capable of overseeing negotiations with landowners, the design/construction phases, and tenant attraction at a high level. This had become a bottleneck for growth.",「不足している事業の推進力そのものを当社が提供する」という方針のもと、Tryfundsから実務とマネジメントに長けた人材（社長クラス・事業責任者）を直接クライアント内へ送り込みました。内部の体制構築を強化すると同時に、Tryfundsの持つ多彩なデベロッパーや投資家ネットワークを繋ぎ、優良なプロジェクトパートナーとのアライアンスを次々と締結させました。,"Under the policy of 'We will provide the very driving force the business lacks,' Tryfunds directly dispatched talent highly skilled in practical execution and management (President-class and Business Heads) into the client's operations. While strengthening the internal organizational structure, we connected Tryfunds' diverse network of developers and investors, successively concluding alliances with excellent project partners.",現場の強力な推進エンジンを得たことで、案件の消化スピードと質が劇的に向上。単なるコンサルティングを超え、事業運営会社としてクライアントの内部から事業成長を牽引した代表的な事例です。,"Acquiring a powerful driving engine on the frontlines dramatically improved the speed and quality of project execution. Moving beyond mere consulting, this is a representative case where we drove business growth from within the client as a business operating company."
us-real-estate,総事業費600億円：NY近郊高層ビルのアセットマネジメント,Total Project Cost 60B JPY: Asset Management for a High-rise Building Near NY,米国不動産AM,Asset Management / Finance,Asset Management / Finance,ニューヨークエリアにおける総事業費600億円規模の高層ビル開発について、最適な投資スキームの構築から資金調達、日本企業への投資機会提供までを網羅。,Covered everything from structuring the optimal investment scheme to fundraising and providing investment opportunities to Japanese companies for a high-rise building development costing 60 billion JPY in the NY area.,"Real Estate, Asset Management, Cross-border Finance, New York","600億円規模のプロジェクト組成
複雑なクロスボーダー資金調達の完遂
国内企業向け優良投資機会の創出","Structuring a 60 billion JPY project
Completion of complex cross-border fundraising
Creation of premium investment opportunities for domestic companies",ニューヨーク近郊のプライムロケーションにおける、総事業費にして600億円を超える巨大な高層ビル開発プロジェクト。世界中から投資マネーが集まる市場において、緻密なストラクチャリングが求められていました。,"A massive high-rise development project boasting a total project cost exceeding 60 billion JPY in a prime location near New York. In a market where investment money gathers from around the world, meticulous structuring was required.",巨額の資金調達だけでなく、米国特有の不動産税制、リーガルリスクをクリアする高度なスキーム構築が必要でした。同時に、この魅力的な案件に対する日本の機関投資家・事業会社の投資参入ハードルをいかに下げるかが問われました。,"It necessitated highly sophisticated scheme construction to clear not only massive fundraising hurdles but also US-specific real estate tax systems and legal risks. At the same time, the challenge was how to lower the barriers to entry for Japanese institutional investors and operating companies to participate in this highly attractive deal.",ファイナンスのプロフェッショナルチームが、現地のディベロッパーや金融機関と綿密に連携し、最適なアセットマネジメント（AM）体制とビークル（投資事業組合等）を設計。メザニンからエクイティに至るまでの複雑な資金調達スキームを組成しました。さらに、日本の投資家向けにリスク・リターンをクリアにした投資パッケージを組成し、アプローチを実施しました。,"Our professional finance team worked closely with local developers and financial institutions to design the optimal asset management (AM) structure and vehicle (such as an investment limited partnership). We structured a complex financing scheme ranging from mezzanine to equity. Furthermore, we structured and marketed an investment package for Japanese investors that clearly defined the risks and returns.",無事に数百億円規模のファンドレイズを完了し、プロジェクトは本格稼働。日本国内の企業に対して、通常ではアクセスが困難な米国の超優良不動産開発への直接的な投資機会を提供し、グローバルな資金還流のブリッジとして機能しました。,"Successfully completing a fundraising of tens of billions of yen, the project went into full swing. We provided domestic companies with direct investment opportunities in ultra-premium US real estate developments that are normally difficult to access, functioning as a bridge for global capital repatriation."
