id,title,title_en,client,category,category_en,summary,summary_en,tags,results,results_en,content_background,content_bg_en,content_challenges,content_chall_en,content_approach,content_approach_en,content_outcome,content_out_en
ishizaka-branding,産業廃棄物処理業から「環境創造企業」へのブランド変革,Brand Transformation from Industrial Waste Disposal to an 'Environmental Creation Company',石坂産業,Branding / ESG,Branding / ESG,「ごみ屋」という旧来のイメージを払拭し、自然と共生する未来の環境創造ビジネスとしての強力なブランドアイデンティティを策定。,"Dispelled the old image of a 'garbage collector,' formulating a powerful brand identity as a futuristic environmental creation business coexisting with nature.","Corporate Branding, ESG, Sustainability, Industrial Innovation","新しいパーパスとVIの策定
業界イメージの根本的な転換
国内外からの視察増・メディア露出拡大","Formulation of a new purpose and VI
Fundamental shift in industry image
Increased domestic and international inspections/media exposure",高度なリサイクル技術と広大な里山保全活動により、他に類を見ない産業廃棄物処理のエコシステムを持つ石坂産業。しかし、世間からは依然として「産廃業者＝ネガティブなイメージ」で見られてしまうジレンマがありました。,"Through highly advanced recycling technologies and expansive woodland conservation activities, Ishizaka possessed an unparalleled industrial waste disposal ecosystem. However, they faced the dilemma of still being viewed by society through the 'Industrial Waste Disposer = Negative Image' lens.",世界に誇るべき自社の環境技術と理念が、企業のブランド価値に直結していないこと。B2Bの枠を超え、社会全体やグローバルに対してその価値を正確に伝えるための「リブランディング」が求められていました。,Their world-class environmental technologies and philosophy were not directly translating into corporate brand value. A 'rebranding' was required to accurately communicate that value beyond the B2B framework to society at large and the globe.,Tryfundsは経営陣と深い対話を重ね、企業が社会に存在する意味（パーパス）を再定義。「産業廃棄物を処理する」企業から「自然と共生し、地球の未来を創る」企業への変革を言語化しました。視覚的なロゴやVI（ヴィジュアルアイデンティティ）の刷新から、工場の「見せる化（テーマパーク化）」を促すコミュニケーション戦略まで、ブランド戦略全体を一気通貫で設計・実行しました。,"Tryfunds engaged in deep dialogue with the management team and redefined the meaning of the company's existence in society (Purpose). We verbalized the transformation from a company that 'disposes of industrial waste' to one that 'coexists with nature and creates the Earth's future.' From renewing the visual logo and VI (Visual Identity) to a communication strategy encouraging the 'Showcasing (Theme Park-ification)' of the factory, we designed and executed the entire brand strategy seamlessly.",ブランディングの刷新により業界内外での認知と評価が劇的に向上し、現在では世界中から行政や企業が視察に訪れるサステナビリティの聖地へと進化。企業の事業力とブランド力が完全に融合したESG経営の成功事例となりました。,"The renewed branding dramatically improved recognition and evaluation both inside and outside the industry, evolving the facility into a sustainability mecca currently visited by governments and corporations from all over the world. It became a successful case of ESG management where the company's business strength and brand strength were perfectly integrated."
regional-tourism,事業投資型・広域インバウンド観光戦略プロジェクト,"Business Investment-driven, Wide-area Inbound Tourism Strategy Project",大手金融機関 × 地方自治体,Regional Revitalization / Investment,Regional Revitalization / Investment,フィービジネスに留まらず、地方の観光名所づくりに対してTryfunds自らが事業投資を敢行。コンサルティングとリターンの両取りを実現した独自モデル。,"Going beyond fee business, Tryfunds dared to make principal investments to create local tourist attractions. A unique model achieving both consulting fees and investment returns.","Regional Revitalization, Tourism Strategy, Principal Investment, Inbound","インバウンド向け新観光名所の創出
コンサル＆プリンシパル投資のハイブリッド回収
地域経済の自律的成長エコシステム構築","Creation of new tourist attractions for inbound visitors
Hybrid recovery of consulting fees and principal investment
Construction of a self-sustaining growth ecosystem for the regional economy",新潟県佐渡島へのインバウンド需要の波を波及させるため、大手金融機関と地方自治体がタッグを組んだ広域観光戦略プロジェクト。しかし、「絵に描いた餅」の戦略書だけでは、実際に地元にお金が落ちる仕組みは回りません。,"A wide-area tourism strategy project where a major financial institution and local governments teamed up to spread the wave of inbound demand to Sado Island, Niigata. However, a strategy document that is mere 'pie in the sky' does not make money flow into the local area in reality.",観光地の魅力化には初期投資と事業運営のノウハウが必須ですが、地元企業だけではリスクを取り切れない現実がありました。外部からの「アドバイス」だけでなく、本気でリスクを背負ってプロジェクトを牽引するプレイヤーが必要でした。,"Initial investments and operational know-how are essential to make tourist destinations attractive, but the reality was that local businesses alone could not bear all the risks. What was needed was a player who would not merely offer external 'advice' but would seriously take on risks to drive the project forward.",Tryfundsは観光戦略のグランドデザイン（戦略策定、動線設計、プロモーション戦略）を提供するだけでなく、プロジェクトそのものに「プリンシパル投資」として自社資金を投入しました。古民家の改修や新たなアクティビティ拠点の開発に自ら事業者として参画することで、事業推進のスピードとコミットメントを圧倒的なレベルに引き上げました。,"Tryfunds not only provided the grand design of the tourism strategy (strategy formulation, flow design, promotion strategy) but also injected its own capital into the project itself as 'principal investment.' By participating as an operator ourselves in the renovation of old folk houses and the development of new activity hubs, we elevated the speed of business promotion and commitment to an overwhelming level.",戦略書通りに魅力的な観光名所が次々とオープンし、海外からの観光客誘致に成功。Tryfundsはコンサルティングによる固定フィーだけでなく、観光事業の収益を通じたリターンを得ることに成功。まさに「リスクを負う共同事業者」としてのTryfundsの真骨頂を示すプロジェクトとなりました。,"Following the strategy document, attractive tourist spots opened one after another, successfully drawing tourists from overseas. Tryfunds succeeded in generating returns through the profitability of the tourism business, in addition to fixed consulting fees. It was a project that truly demonstrated the essence of Tryfunds as a 'Co-operator who shares the risk.'"
daishi-hokuetsu-fund,地域開発を真に推進するマルチアセットGPファンド組成,Structuring a Multi-Asset GP Fund to Truly Drive Regional Development,第四北越銀行,Fund Formation / Regional Revitalization,Fund Formation / Regional Revitalization,地方創生において単一事業・単一不動産への投資だけでは不十分と考え、事業投資、不動産、エネルギー、インフラなど異なるアセットを組み合わせたエリア集中投資ファンドを立ち上げ。,"Believing that investing in a single business or real estate property is insufficient for regional revitalization, we launched an area-focused investment fund combining different assets such as business investments, real estate, energy, and infrastructure.","Fund Formation, Co-GP, Regional Development, Multi-Asset","共同GPファンドの設立
エリア集中投資モデルの確立
アセットクラスを跨いだポートフォリオ設計","Establishment of a Co-GP Fund
Establishment of an area-focused investment model
Cross-asset-class portfolio design",地域金融機関である第四北越銀行は、地元経済の活性化という強力な使命感を持っていました。しかし、従来の金融支援だけでは地域を根本から変革することが難しく、より踏み込んだ地域開発アプローチが求められていました。,"Daishi Hokuetsu Bank, a regional financial institution, possessed a strong sense of mission to revitalize the local economy. However, conventional financial support alone made it difficult to fundamentally transform the region, demanding a more profound approach to regional development.",地域開発を「真に」成功させるためには、単純に一つの事業に出資したり、一つの不動産を買うだけでは不十分でした。点ではなく「面（エリア）」での集中した投資が必要であり、そのためには事業、不動産、エネルギー、インフラなど、アセットクラスの異なる複数の対象へ同時に投資できる器（ファンド）をゼロから設計しなければならないという前例のない課題がありました。,"To 'truly' succeed in regional development, simply investing in one business or buying a single property was not enough. Concentrated investments across an 'area (surface)' rather than just 'points' were necessary. Consequently, there was an unprecedented challenge to design a vehicle (fund) from scratch capable of simultaneously investing in multiple targets with different asset classes, such as businesses, real estate, energy, and infrastructure.",Tryfundsは第四北越銀行と共同GP（運用責任者）としてタッグを組み、アセットクラス横断型の全く新しい地方創生ファンド構想を立ち上げました。Tryfundsがこれまで培ってきた「事業マネジメント」「不動産AM」「エネルギー/インフラ開発」のナレッジをフル活用し、金融規制や投資家リターン要件をクリアする複雑なスキームを構築・実行しました。,"Tryfunds partnered with Daishi Hokuetsu Bank as a Co-GP (General Partner), launching a completely new, cross-asset-class regional development fund concept. Fully applying the knowledge in 'Corporate Management,' 'Real Estate AM,' and 'Energy/Infrastructure Development' that Tryfunds had cultivated over the years, we constructed and executed a complex scheme that cleared financial regulations and investor return requirements.",国内でも稀有な「マルチアセット型・エリア集中投資ファンド」が無事組成され、地域の面的価値を押し上げるための直接的な投資活動がスタートしました。地域のポテンシャルを最大限に引き出す、新しい地方創生ファイナンスのモデルケースとなっています。,"A 'Multi-asset, Area-focused Investment Fund'—rare even in Japan—was successfully structured, initiating direct investment activities aimed at boosting the areal value of the region. It has become a model case for new regional revitalization finance that maximizes the potential of local communities."
